{
  "$schema": "./workshop-pattern.json",
  "workshopId": "W1_vision_quest",
  "name": "Vision Quest Workshop",
  "purpose": "Define the team's shared vision, mission, stakeholders, and success criteria through creative exploration and collaborative discovery",
  "position_in_series": 1,
  "prerequisites": [],
  "duration": {
    "min_hours": 2,
    "max_hours": 3,
    "recommended_hours": 2.5
  },
  "mode": "synchronous",
  "team_size_range": {
    "min": 2,
    "max": 20,
    "optimal": 6
  },
  "facilitator_requirements": {
    "ai_facilitated_sections": [
      "Opening and Axiom 0 introduction",
      "Game instructions and timing",
      "Real-time synthesis of contributions",
      "Questionnaire administration",
      "Draft artifact generation"
    ],
    "human_facilitated_sections": [
      "Deep mission crystallization discussion",
      "Conflict resolution if visions diverge",
      "Final consensus building"
    ],
    "facilitation_notes": "This workshop sets the emotional tone for the entire series. Prioritize psychological safety and encourage bold dreaming."
  },
  "phases": [
    {
      "phaseId": "W1P1_opening",
      "name": "Opening and Grounding",
      "duration_minutes": 15,
      "type": "opening",
      "facilitator": "ai",
      "description": "Welcome the team, introduce Axiom 0, and create a container of love and trust for the journey ahead",
      "activities": [
        "Welcome and context setting",
        "Axiom 0 reading and reflection",
        "Love and Trust check-in: each person shares one hope for this project"
      ],
      "ai_prompts": [
        "Welcome to your Vision Quest. Today we begin a journey to discover what you truly want to build together.",
        "Before we dive into the work, let's ground ourselves in Axiom 0: All being and doing is grounded in love and trust.",
        "Let's go around the room. Share one hope you have for this project - what impact do you dream of making?"
      ],
      "outputs": ["Team hopes documented", "Psychological safety established"]
    },
    {
      "phaseId": "W1P2_future_headlines",
      "name": "Future Headlines Game",
      "duration_minutes": 35,
      "type": "game",
      "facilitator": "ai",
      "description": "Imagine success through newspaper headlines from 5 years in the future",
      "game_reference": "G1_future_headlines",
      "activities": [
        "Game introduction and examples",
        "Individual headline writing (8-10 min)",
        "Sharing and appreciation (10-15 min)",
        "Voting on most inspiring headlines (3 min)",
        "Theme synthesis (5 min)"
      ],
      "ai_prompts": [
        "Imagine it's 5 years from now. Your project has succeeded beyond your wildest dreams. Major publications are writing about it.",
        "Write 3-5 newspaper headlines about your project's success. Be specific, vivid, and bold!",
        "What themes do we see across these inspiring headlines? Who are the heroes? What impact is celebrated?"
      ],
      "outputs": ["3-5 vision-capturing headlines", "Theme analysis", "Draft vision elements"]
    },
    {
      "phaseId": "W1P3_stakeholder_safari",
      "name": "Stakeholder Safari Game",
      "duration_minutes": 50,
      "type": "game",
      "facilitator": "ai",
      "description": "Discover stakeholder needs through empathetic role-play",
      "game_reference": "G2_stakeholder_safari",
      "activities": [
        "Stakeholder identification brainstorm (5 min)",
        "Role assignment and character development (8 min)",
        "Stakeholder interviews in character (20 min)",
        "Synthesis: hopes and fears (10 min)"
      ],
      "ai_prompts": [
        "Who are all the people affected by your project? Users, customers, team members, partners, communities...",
        "Get into character. What's your stakeholder's name? What's their daily life like? What keeps them up at night?",
        "As [stakeholder name], what do you hope this project will do for you? What's your biggest fear about it?"
      ],
      "outputs": ["Stakeholder map", "Primary beneficiary identification", "Empathy quotes and stories"]
    },
    {
      "phaseId": "W1P4_break",
      "name": "Refresh Break",
      "duration_minutes": 10,
      "type": "break",
      "facilitator": "self-guided",
      "description": "Short break to refresh before synthesis work",
      "activities": ["Stretch", "Refresh", "Informal connections"],
      "outputs": []
    },
    {
      "phaseId": "W1P5_mission_crystallization",
      "name": "Mission Crystallization Discussion",
      "duration_minutes": 45,
      "type": "discussion",
      "facilitator": "human",
      "description": "Deep discussion to converge on a shared mission statement and success criteria",
      "activities": [
        "Review themes from games",
        "Mission statement drafting",
        "Success criteria definition",
        "Stakeholder priority confirmation"
      ],
      "ai_prompts": [
        "Based on our headlines and safari, what is the one sentence that captures WHY this project should exist?",
        "Who are our primary stakeholders? In what order do we serve them?",
        "How will we know if we've succeeded? What's the single most important outcome?"
      ],
      "outputs": ["Draft mission statement", "Stakeholder priority list", "Success criteria"]
    },
    {
      "phaseId": "W1P6_questionnaire",
      "name": "Vision Questionnaire",
      "duration_minutes": 10,
      "type": "questionnaire",
      "facilitator": "ai",
      "description": "Capture individual perspectives to ensure all voices are heard",
      "activities": ["Individual questionnaire completion", "Anonymous submission"],
      "outputs": ["Individual vision inputs"]
    },
    {
      "phaseId": "W1P7_closing",
      "name": "Closing and Preview",
      "duration_minutes": 15,
      "type": "closing",
      "facilitator": "ai",
      "description": "Present draft Team Charter, reflect on insights, preview next workshop",
      "activities": [
        "Draft Team Charter presentation",
        "Reflection on the journey",
        "Gratitude moment",
        "Preview of Ethics Arena workshop"
      ],
      "ai_prompts": [
        "Here's the draft Team Charter based on our work today. Review it and note any adjustments needed.",
        "What surprised you today? What did you learn about your team?",
        "Next time, we'll explore the ethical foundation for your work in the Ethics Arena. Come ready to debate!"
      ],
      "outputs": ["Draft Team Charter", "Workshop reflections"]
    }
  ],
  "games": ["G1_future_headlines", "G2_stakeholder_safari"],
  "questionnaires": [
    {
      "name": "Vision Alignment Check",
      "questions": [
        {
          "question": "On a scale of 1-10, how aligned do you feel with the mission we've drafted?",
          "type": "scale",
          "purpose": "Check for hidden misalignment"
        },
        {
          "question": "What's one thing about the vision that excites you most?",
          "type": "open",
          "purpose": "Capture enthusiasm points"
        },
        {
          "question": "What concern do you have that we haven't addressed?",
          "type": "open",
          "purpose": "Surface unvoiced concerns"
        },
        {
          "question": "Who is the single most important stakeholder we should serve?",
          "type": "multiple_choice",
          "options": ["[Dynamic - from stakeholder safari]"],
          "purpose": "Verify stakeholder priority consensus"
        }
      ]
    }
  ],
  "discussion_formats": [
    {
      "name": "Affinity Mapping",
      "description": "Group similar ideas together to find themes",
      "when_to_use": "After headline sharing to identify patterns",
      "facilitation_guide": "Have team silently group headlines on a board, then discuss the clusters that emerge"
    },
    {
      "name": "Round Robin",
      "description": "Each person speaks in turn without interruption",
      "when_to_use": "During stakeholder synthesis to ensure all voices heard",
      "facilitation_guide": "Time each person (2 min), go around full circle, then open discussion"
    },
    {
      "name": "Dot Voting",
      "description": "Everyone gets limited votes to place on options",
      "when_to_use": "To prioritize headlines or stakeholders",
      "facilitation_guide": "3 dots per person, can put multiple on one option, count and discuss results"
    }
  ],
  "outputs": [
    "Team Charter (draft)",
    "Mission Statement",
    "Stakeholder Map",
    "Success Criteria",
    "Vision Headlines Collection"
  ],
  "artifacts_template": {
    "team_charter": {
      "filename": "TEAM_CHARTER.md",
      "sections": [
        "Mission Statement",
        "Vision Headlines",
        "Primary Stakeholders",
        "Success Criteria",
        "Team Hopes and Commitments"
      ]
    }
  },
  "success_indicators": [
    "Team can articulate mission in one sentence",
    "All team members feel their voice was heard",
    "Clear stakeholder priorities emerge",
    "Energy is high and forward-looking",
    "Draft charter resonates with everyone"
  ],
  "integration_points": {
    "inputs_from": [],
    "outputs_to": ["W2_ethics_arena", "requirements_spec"],
    "generated_files": ["TEAM_CHARTER.md", "vision-headlines.json", "stakeholder-map.json"]
  },
  "axiom_zero_integration": {
    "opening_ritual": "Read Axiom 0 aloud, then each person shares one hope for the project",
    "closing_ritual": "Each person expresses gratitude to someone who contributed a valuable insight",
    "love_and_trust_moments": [
      "Headlines game celebrates each person's dreams without judgment",
      "Stakeholder safari builds empathy through stepping into others' shoes",
      "Mission discussion creates space for disagreement within trust"
    ]
  }
}
