{
  "$schema": "./workshop-pattern.json",
  "workshopId": "W4_agent_assembly",
  "name": "Agent Assembly Workshop",
  "purpose": "Design custom AI agents and skills that will support the team's development workflow",
  "position_in_series": 4,
  "prerequisites": ["W1_vision_quest", "W2_ethics_arena", "W3_stack_safari"],
  "duration": {
    "min_hours": 3,
    "max_hours": 4,
    "recommended_hours": 3.5
  },
  "mode": "hybrid",
  "team_size_range": {
    "min": 2,
    "max": 16,
    "optimal": 6
  },
  "facilitator_requirements": {
    "ai_facilitated_sections": [
      "Agent concept introduction",
      "Trading card game mechanics",
      "Skill bingo administration",
      "Synthesis and generation"
    ],
    "human_facilitated_sections": [
      "Creative brainstorming",
      "Agent personality development",
      "Workflow design discussions"
    ],
    "facilitation_notes": "This is the most hands-on workshop. Encourage creativity while ensuring practical outcomes."
  },
  "phases": [
    {
      "phaseId": "W4P1_opening",
      "name": "Opening and Agent Introduction",
      "duration_minutes": 15,
      "type": "opening",
      "facilitator": "ai",
      "description": "Introduce the concept of AI agents and how they'll support the team",
      "activities": [
        "Review journey so far",
        "Introduce agent concepts",
        "Show example agents from blueprints"
      ],
      "ai_prompts": [
        "You've defined your vision, ethics, and technology. Now let's design the AI agents that will help you build it.",
        "Agents are specialized AI assistants with defined roles, skills, and personalities. They become your development partners.",
        "Here are some example agents: Code Reviewer, Test Generator, Explorer. Today you'll design your own."
      ],
      "outputs": ["Agent concept understanding"]
    },
    {
      "phaseId": "W4P2_agent_brainstorm",
      "name": "Agent Brainstorm",
      "duration_minutes": 20,
      "type": "discussion",
      "facilitator": "human",
      "description": "Brainstorm all the agent roles the team might need",
      "activities": [
        "Free-form brainstorm of agent roles",
        "Categorize by function",
        "Prioritize initial set"
      ],
      "ai_prompts": [
        "What AI helpers would make your development life easier?",
        "Think about: What repetitive tasks drain you? What expertise would you love to have available?",
        "Consider agents for: coding, reviewing, testing, documenting, exploring, researching, communicating..."
      ],
      "outputs": ["Agent role candidates"]
    },
    {
      "phaseId": "W4P3_trading_cards",
      "name": "Agent Trading Cards Game",
      "duration_minutes": 60,
      "type": "game",
      "facilitator": "ai",
      "description": "Design agents as collectible trading cards with stats and abilities",
      "game_reference": "G7_agent_trading_cards",
      "activities": [
        "Trading card template introduction (5 min)",
        "Card creation (25 min)",
        "Card gallery and voting (15 min)",
        "Deck assembly (15 min)"
      ],
      "ai_prompts": [
        "Each agent gets a trading card with: Name, Visual, Stats, Primary Ability, Secondary Ability, Weakness, Lore, Synergy.",
        "Give your agent personality! What's their catchphrase? What's their story?",
        "Which agents work well together? What combos could we create?"
      ],
      "outputs": ["Agent trading cards", "Agent roster"]
    },
    {
      "phaseId": "W4P4_break",
      "name": "Refresh Break",
      "duration_minutes": 10,
      "type": "break",
      "facilitator": "self-guided",
      "description": "Short break before skill design",
      "activities": ["Stretch", "Refresh"],
      "outputs": []
    },
    {
      "phaseId": "W4P5_skill_bingo",
      "name": "Skill Bingo Game",
      "duration_minutes": 40,
      "type": "game",
      "facilitator": "ai",
      "description": "Identify needed skills through competitive pattern completion",
      "game_reference": "G8_skill_bingo",
      "activities": [
        "Bingo card creation (10 min)",
        "Skill calling rounds (15 min)",
        "Full card analysis (10 min)",
        "Skill prioritization (5 min)"
      ],
      "ai_prompts": [
        "Fill your bingo card with skills your project needs. Mix obvious and creative!",
        "Skill: [name]. Who has this? Explain why your project needs it to mark it.",
        "What skills appeared most often? These are your must-haves."
      ],
      "outputs": ["Skill priority list", "Skill combinations"]
    },
    {
      "phaseId": "W4P6_workflow_design",
      "name": "Workflow Design",
      "duration_minutes": 25,
      "type": "discussion",
      "facilitator": "human",
      "description": "Design how agents and skills combine into workflows",
      "activities": [
        "Map skills to agents",
        "Design workflow sequences",
        "Identify automation opportunities"
      ],
      "ai_prompts": [
        "How do these agents and skills work together?",
        "When a bug comes in, what's the workflow? Which agents participate?",
        "What triggers should activate which skills?"
      ],
      "outputs": ["Workflow designs", "Agent-skill mapping"]
    },
    {
      "phaseId": "W4P7_questionnaire",
      "name": "Agent Design Questionnaire",
      "duration_minutes": 10,
      "type": "questionnaire",
      "facilitator": "ai",
      "description": "Capture individual preferences and ideas",
      "activities": ["Individual questionnaire completion"],
      "outputs": ["Individual agent design inputs"]
    },
    {
      "phaseId": "W4P8_closing",
      "name": "Closing and Preview",
      "duration_minutes": 15,
      "type": "closing",
      "facilitator": "ai",
      "description": "Synthesize agent designs, preview Integration Celebration",
      "activities": [
        "Present agent roster summary",
        "Show skill priority list",
        "Preview final workshop"
      ],
      "ai_prompts": [
        "Here's your agent roster - your development dream team!",
        "These are the skills we'll generate for your agents.",
        "Next time, we bring it all together in the Integration Celebration. Come ready to demo and celebrate!"
      ],
      "outputs": ["Agent roster", "Skill list", "Workflow documentation"]
    }
  ],
  "games": ["G7_agent_trading_cards", "G8_skill_bingo"],
  "questionnaires": [
    {
      "name": "Agent Design Check",
      "questions": [
        {
          "question": "Which agent are you most excited to work with?",
          "type": "open",
          "purpose": "Identify enthusiasm points"
        },
        {
          "question": "What agent capability did we miss?",
          "type": "open",
          "purpose": "Catch gaps"
        },
        {
          "question": "On a scale of 1-10, how well does our agent roster cover our needs?",
          "type": "scale",
          "purpose": "Check coverage confidence"
        },
        {
          "question": "What workflow would benefit most from agent automation?",
          "type": "open",
          "purpose": "Prioritize automation"
        }
      ]
    }
  ],
  "discussion_formats": [
    {
      "name": "Role Storm",
      "description": "Rapid-fire brainstorm of agent roles without judgment",
      "when_to_use": "During agent brainstorm phase",
      "facilitation_guide": "No critique during brainstorm. 30 seconds per idea. Quantity over quality initially."
    },
    {
      "name": "Synergy Mapping",
      "description": "Visual mapping of which agents work well together",
      "when_to_use": "During deck assembly",
      "facilitation_guide": "Draw agents as nodes, connections show synergies. Thicker lines = stronger synergy."
    }
  ],
  "outputs": [
    "Agent Roster (trading cards)",
    "Skill Priority List",
    "Agent-Skill Mapping",
    "Workflow Designs",
    "Automation Opportunities"
  ],
  "artifacts_template": {
    "agent_roster": {
      "filename": "agent-roster.json",
      "sections": [
        "Agent Trading Cards",
        "Synergy Map",
        "Priority Order"
      ]
    },
    "skill_list": {
      "filename": "skill-priorities.json",
      "sections": [
        "Must-Have Skills",
        "Nice-to-Have Skills",
        "Custom Skills"
      ]
    }
  },
  "success_indicators": [
    "Team excited about their agent roster",
    "Agents have distinct personalities and roles",
    "Skills cover identified needs",
    "Workflows make practical sense",
    "Balance of creativity and practicality"
  ],
  "integration_points": {
    "inputs_from": ["W1_vision_quest", "W2_ethics_arena", "W3_stack_safari"],
    "outputs_to": ["W5_integration_celebration", "agent_generation", "skill_generation"],
    "generated_files": ["agent-roster.json", "skill-priorities.json", "workflow-designs.json", ".cursor/agents/*.md"]
  },
  "axiom_zero_integration": {
    "opening_ritual": "Remember: these agents embody love and trust - they're partners, not tools",
    "closing_ritual": "Thank the team for bringing creativity to this technical task",
    "love_and_trust_moments": [
      "Creating agents with personalities shows love for the tools we'll use daily",
      "Designing weaknesses requires trust that imperfection is acceptable",
      "Skill bingo celebrates everyone's ideas equally"
    ]
  }
}
